### ISSUE TITLE
Timeout reading object but works in IED scout

### ISSUE THREAD

**Issue by mgimelgithu** [mz-automation/libiec61850#556]
<img width="518" height="746" alt="Image" src="https://github.com/user-attachments/assets/2a5ae8ec-0323-431e-aa00-eea661c16f8d" />

I use example code to try reading object on MICOM relay.

```
if (error == IED_ERROR_OK)
    {
        printf("Connected\n");

        /* read an analog measurement value from server */
        MmsValue* value = IedConnection_readObject(con, &error, "TRF1F50Measurements/PriFouMMXU1.Hz.mag.f", IEC61850_FC_MX);

        if (value != NULL)
        {
            if (MmsValue_getType(value) == MMS_FLOAT) {
                float fval = MmsValue_toFloat(value);
                printf("read float value: %f\n", fval);
            }
            else if (MmsValue_getType(value) == MMS_DATA_ACCESS_ERROR) {
                printf("Failed to read value (error code: %i)\n", MmsValue_getDataAccessError(value));
            }
            else {
                printf("Unexpected value type: %i\n", MmsValue_getType(value));
            }

            MmsValue_delete(value);
        } else
        {
            printf("Failed to read value (error code: %i)\n", error);
        }
```

i modified it a bit to see the error and i got error code 20 (Timeout)

```
Connecting to xxx:xxx
Connected
MmsConnection_readVariable: domainId=TRF1F50Measurements, itemId=PriFouMMXU1$MX$Hz$mag$f
Failed to read value (error code: 20)
```

i also try using IED Explorer to read the object but it also didn't work and i got error like this

```
[15/07/2025 14:28:19.083] Information: [OSI_CONNECT_PRES]
[15/07/2025 14:28:19.234] Information: Services Supported: status,getNameList,identify,read,write,getVariableAccessAttributes,getNamedVariableListAttributes,getDomainAttributes,obtainFile,getCapabilityList,fileOpen,fileRead,fileClose,fileDelete,fileDirectory,informationReport,conclude,cancel,
[15/07/2025 14:28:19.237] Information: [IEC61850_STATE_START] (Send IdentifyRequest)
[15/07/2025 14:28:24.374] Warning: MMS Identify message not supported by server, although declared in ServicesSupportedCalled bitstring
```

I trace the packet using wireshark to see the different between IED Scout and the program but i find it was very similar 

Program : 
```
Frame 231: 152 bytes on wire (1216 bits), 152 bytes captured (1216 bits)
Ethernet II, Src: RaspberryPiT_94:3a:06 (e4:5f:01:94:3a:06), Dst: zte_52:77:ff (20:08:89:52:77:ff)
Internet Protocol Version 4, Src: 192.168.2.33, Dst: xx
Transmission Control Protocol, Src Port: 48986, Dst Port: 1415, Seq: 210, Ack: 185, Len: 86
TPKT, Version: 3, Length: 86
ISO 8073/X.224 COTP Connection-Oriented Transport Protocol
ISO 8327-1 OSI Session Protocol
ISO 8327-1 OSI Session Protocol
ISO 8823 OSI Presentation Protocol
MMS
    confirmed-RequestPDU [GetDataValueRequest]
        invokeID: 1
        confirmedServiceRequest: read (4)
            read
                specificationWithResult: False
                variableAccessSpecificatn: listOfVariable (0)
                    listOfVariable: 1 item
                        listOfVariable item
                            variableSpecification: name (0)
                                name: domain-specific (1)
                                    domain-specific
                                        domainId: TRF1F50Measurements
                                        itemId: PriFouMMXU1$MX$Hz$mag$f
```

IED Scout
```
Frame 567166: 151 bytes on wire (1208 bits), 151 bytes captured (1208 bits) on interface \Device\NPF_{EF14B2AD-17AA-43FF-B669-7D256FEA85CC}, id 0
Ethernet II, Src: Intel_da:4c:5b (f4:96:34:da:4c:5b), Dst: zte_52:77:ff (20:08:89:52:77:ff)
Internet Protocol Version 4, Src: 192.168.2.23, Dst: xx
Transmission Control Protocol, Src Port: 52408, Dst Port: 1415, Seq: 33306, Ack: 480613, Len: 97
TPKT, Version: 3, Length: 97
    Version: 3
    Reserved: 0
    Length: 97
ISO 8073/X.224 COTP Connection-Oriented Transport Protocol
    Length: 2
    PDU Type: DT Data (0x0f)
    [Destination reference: 0x10480011]
    .000 0000 = TPDU number: 0x00
    1... .... = Last data unit: Yes
ISO 8327-1 OSI Session Protocol
    SPDU Type: Give tokens PDU (1)
    Length: 0
ISO 8327-1 OSI Session Protocol
    SPDU Type: DATA TRANSFER (DT) SPDU (1)
    Length: 0
ISO 8823 OSI Presentation Protocol
    user-data: fully-encoded-data (1)
        fully-encoded-data: 1 item
            PDV-list
                presentation-context-identifier: 3 (mms-abstract-syntax-version1(1))
                presentation-data-values: single-ASN1-type (0)
MMS
    confirmed-RequestPDU [GetDataValueRequest]
        invokeID: 297
        confirmedServiceRequest: read (4)
            read
                specificationWithResult: False
                variableAccessSpecificatn: listOfVariable (0)
                    listOfVariable: 1 item
                        listOfVariable item
                            variableSpecification: name (0)
                                name: domain-specific (1)
                                    domain-specific
                                        domainId: TRF1F50Measurements
                                        itemId: PriFouMMXU1$MX$A1$phsA$cVal$mag$f
[Response In: 567168]
```

is there something wrong with the library or there are problem with my connection to relay
